PARKID,First_Game,First_Score_Winner,First_Attendance,First_Starting_Pitchers,First_Batter,First_Game_Result,First_Hit,First_Result_Inning,First_Run,First_RBI,First_HR,Date_Game_No,First_K_Batter,First_Win,First_Loss,First_Grand_Slam,First_Inside_the_Park_HR,First_No_Hitter,Last_Game,Last_Score_Winner,Last_Attendance,Last_Starting_Pitchers,Last_Batter,Last_Game_Result,Last_Hit,Last_Result_Inning,Last_Run,Last_RBI,Last_HR,Last_K_Batter,Last_Win,Last_Loss,Last_Grand_Slam,Last_Inside_the_Park_HR,Last_Most_Recent_No_Hitter,Trivia
STP01,Devil Rays vs. Tigers: 3/31/1998,11-6 (DET),"45,369",Wilson Alvarez (TBA); Justin Thompson (DET),Brian Hunter (DET),Grounded to 1B,Tony Clark (DET),Singled to 2B (2nd),Tony Clark (DET),Joe Randa (DET),Luis Gonzalez (DET) vs. Dan Carlson (TBA) on 3/31/1998 (5th inning),3/31/1998 (1),Wilson Alvarez (TBA)/Bip Roberts (DET),Justin Thompson (DET),Wilson Alvarez (TBA),Johnny Damon (KCA) vs. Dennis Springer (TBA) on 5/14/1998 (2nd inning),Dave Martinez (TBA) vs. Hideki Irabu (NYA) on 7/10/1998 (4th inning),Edwin Jackson (ARI) vs. Devil Rays on 6/25/2010,,,,,,,,,,,,,,,,,,"Tropicana Field was the first park to open in March, beating Arizona's Chase Field by a few hours.  At the time it was the earliest a new park had opened, but was eclipsed by Washington's Nationals Park when it hosted its first game on 3/30/2008. Only nine games separated the first no-hitter thrown at Tropicana Field from the most recent, the smallest gap between no-hitters among active parks."
TOR01,Blue Jays vs. White Sox: 4/7/1977,9-5 (TOR),"44,649",Ken Brett (CHA); Bill Singer (TOR),Ralph Garr (CHA),Walked,Richie Zisk (CHA),Homered (1st),Ralph Garr (CHA),Jorge Orta (CHA),RiCHAe Zisk (CHA) vs. Bill Singer (TOR) on 4/7/1977 (1st inning),4/7/1977 (1),Ken Brett (CHA)/John Scott (TOR),Jerry Johnson (TOR),Ken Brett (CHA),Hector Torres (TOR) vs. Ron Guidry (NYA) on 6/27/1977 (5th inning),Cecil Cooper (ML4) vs. Jerry Garvin (TOR) on 5/5/1977 (5th inning),None,vs. White Sox: 5/28/1989,7-5 (TOR),"46,120",Steve Rosenberg (CHA); Dave Stieb (TOR),George Bell (TOR),Homered to LF,George Bell (TOR),Homered to LF (10),George Bell (TOR),George Bell (TOR),George Bell (TOR) vs. Bobby Thigpen (CHA) on 5/28/1989 (10th inning),Tom Henke (TOR)/Dan Pasqua (CHA),Tom Henke (TOR),Bobby Thigpen (CHA),Mark McGwire (OAK) vs. Tom Henke (TOR) on 5/2/1989 (9th inning),Jim Sundberg (TEX) vs. Frank Wills (TOR) on 9/4/1988 (4th inning),None,
TOR02,Blue Jays vs. Brewers: 6/5/1989,5-3 (MIL),"48,378",Jimmy Key (TOR); Don August (MIL),Paul Molitor (MIL),Doubled to CF,Paul Molitor (MIL),Doubled to CF (1st),Paul Molitor (MIL),Gary Sheffield (MIL),Fred McGriff (TOR) vs. Don August (MIL) on 6/5/1989 (2nd inning),6/5/1989 (1),Jimmy Key (TOR)/Greg Brock (MIL),Don August (MIL),Jimmy Key (TOR),Terry Steinbach (OAK) vs. Duane Ward (TOR) on 7/16/1989 (7th inning),Rance Mulliniks (TOR) vs. Kevin Brown (TEX) on 7/11/1991 (8th inning),Dave Stewart (OAK) vs. Blue Jays on 6/29/1990,,,,,,,,,,,,,,,,,,
WAS08,Senators vs. Athletics: 4/14/1904,8-3 (PHA),"6,144",Eddie Plank (PHA); Highball Wilson (WS1),Topsy Hartsell (PHA),Grounded Out,Bill Coughlin (WS1),Singled (1),Lave Cross (PHA),Monte Cross (PHA),Lew Drill (WS1) vs. Jack Powell (NYA) on 4/25/1904 (7th inning),4/25/1904 (6),Eddie Plank (PHA)/Jake Stahl (WS1),Eddie Plank (PHA),Highball Wilson (WS1),Joe Stanley (WS1) vs. Earl Moore (CLE) on 9/26/1905 (5th inning),Lew Drill (WS1) vs. Jack Powell (NYA) on 4/25/1904 (7th inning),None,vs. Red Sox: 10/6/1910,6-5 (WS1),"4,861",Marty McHale (BOS); Dixie Walker (WS1),Billy Purtell (BOS),Unknown,Larry Gardner (BOS),Singled,Clyde Milan (WS1),Bill Cunningham (WS1),Duffy Lewis (BOS) vs. Dixie Walker (WS1) on 10/6/1910 (5th inning of Game 2 of double header),,Dixie Walker (WS1),Marty McHale (BOS),Cy Falkenberg (WS1) vs. Frank Owen (CHA) on 7/18/1906 (6th inning),Duffy Lewis (BOS) vs. Dixie Walker (WS1) on 10/6/1910 (5th inning of Game 2 of double header),None,"The first homer ever at American League Park II was Lew Drill's last career homer.  The first grand slam ever hit at American League Park II was Joe Stanley's last career homer, both of which were grand slams. The last grand slam at American League Park II was the only home run Cy Falkenberg hit in the major leagues."
WAS09,Senators vs. Red Sox: 4/12/1911,8-5 (WS1),"16,000",Dolly Gray (WS1); Joe Wood (BOS),Larry Gardner (BOS),Lined Out,Bunny Madden (BOS),Singled,Bunny Madden (BOS),Bunny Madden (BOS),Eddie Collins (PHA) vs. Walter Johnson (WS1) on 5/6/1911 (8th inning),5/6/1911 (8),,Dolly Gray (WS1),Joe Wood (BOS),Doc Gessler (WS1) vs. Clarence Mitchell (DET) on 6/2/1911 (8th inning),Eddie Collins (PHA) vs. Walter Johnson (WS1) on 5/6/1911 (8th inning),Bob Burke (WS1) vs. Red Sox on 8/8/1931,vs. Twins: 9/21/1961,6-3 (MIN),"1,498",Bennie Daniels (WS2); Jack Kralick (MIN),Danny O'Connell (WS2),Grounded to SS,Ken Retzer (WS2),Doubled to CF (8),Harmon Killebrew (MIN),Joe Altobelli (MIN),Billy Bryan (KCA) vs. Hector Maestri (WS2) on 9/19/1961 (6th inning),Jack Kralick (MIN)/Bennie Daniels (WS2),Jack Kralick (MIN),Bennie Daniels (WS2),Jake Wood (DET) vs. Ed Hobaugh (WS2) on 8/28/1961 (6th inning),Woody Held (CLE) vs. Johnny Klippstein (WS2) on 6/7/1961 (7th inning),Bob Burke (WS2) vs. Red Sox on 8/8/1931,The last homer ever hit at Griffith Stadium was the first of Billy Bryan's career.
WAS10,Senators vs. Tigers: 4/9/1962,4-1 (WS2),"44,383",Bennie Daniels (WS2); Don Mossi (DET),Jake Wood (DET),Singled to LF,Jake Wood (DET),Singled to LF (1st),Willie Tasby (WS2),Bob Johnson (WS2),Bob Johnson (WS2) vs. Don Mossi (DET) on 4/9/1962 (4th inning),4/9/1962 (1),Don Mossi (DET)/Jimmy Piersall (WS2),Bennie Daniels (WS2),Don Mossi (DET),Clete Boyer (NYA) vs. Pete Burnside (WS2) on 4/27/1962 (4th inning),Chuck Hinton (WS2) vs. Whitey Ford (NYA) on 8/6/1963 (1st inning),None,Phillies vs. Nationals: 9/23/2007,5-3 (WAS),"40,519",Cole Hamels (PHI); Joel Hanrahan (WAS),Jayson Werth (PHI),Struck Out,Aaron Rowand (PHI),Singled to LF (9),Chase Utley (PHI),Aaron Rowand (PHI),Chase Utley (PHI) vs. Tim Redding (WAS) on 9/22/2007 (1st inning),Chad Cordero (WAS)/Jayson Werth (PHI),Luis Ayala (WAS),Antonio Alfonseca (PHI),Dmitri Young (WAS) vs. Rich Hill (CHN) on 7/4/2007 (8th inning),Austin Kearns (WAS) vs. Renyel Pinto (FLO) on 5/12/2007 (6th inning),None,
WAS11,Nationals vs. Braves: 3/30/2008,3-2 (WAS),"39,389",Odalis Perez (WAS); Tim Hudson (ATL),Kelly Johnson (ATL),Struck Out,Cristian Guzman (WAS),Singled to RF (1st),Cristian Guzman (WAS),Nick Johnson (WAS),Chipper Jones (ATL) vs. Odalis Perez (WAS) on 3/30/2008 (4th inning),3/30/2008 (1),Odalis Perez (WAS)/Kelly Johnson (ATL),Jon Rauch (WAS),Peter Moylan (ATL),Felipe Lopez (WAS) vs. Aaron Heilman (NYN) on 4/24/2008 (6th inning),Angel Pagan (NYN) vs. Livan Hernandez (WAS) on 5/19/2010 (4th innng),Jordan Zimmermann (WAS) vs. Marlins on 9/28/2014,,,,,,,,,,,,,,,,,,"When Nationals Park opened on 3/30/2008 it was the earliest date for a park's first game. Kelly Johnson was only the second player to open an active park with a strikeout (Barry Larkin). Angel Pagan is the third player to hit the first inside-the-park home run in two active parks (Fernando Vina, Jimmy Rollins). Jordan Zimmerman's no-hitter came on the last day of the regular season."
