PARKID,First_Game,First_Score_Winner,First_Attendance,First_Starting_Pitchers,First_Batter,First_Game_Result,First_Hit,First_Result_Inning,First_Run,First_RBI,First_HR,Date_Game_No,First_K_Batter,First_Win,First_Loss,First_Grand_Slam,First_Inside_the_Park_HR,First_No_Hitter,Last_Game,Last_Score_Winner,Last_Attendance,Last_Starting_Pitchers,Last_Batter,Last_Game_Result,Last_Hit,Last_Result_Inning,Last_Run,Last_RBI,Last_HR,Last_K_Batter,Last_Win,Last_Loss,Last_Grand_Slam,Last_Inside_the_Park_HR,Last_Most_Recent_No_Hitter,Trivia
ANA01,Angels vs. White Sox: 4/19/1966,3-1 (CHA),"31,660",Marcelino Lopez (CAL); Tommy John (CHA),Tommie Agee (CHA),Grounded to SS,Jim Fregosi (CAL),Doubled to RF (1st),Rick Reichardt (CAL),Rick Reichardt (CAL),Rick Reichardt (CAL) vs. Tommy John (CHA) on 4/19/1966 (2nd inning),4/19/1966 (1),Marcelino Lopez (CAL)/Pete Ward (CHA),Tommy John (CHA),Marcelino Lopez (CAL),Curt Blefary (BAL) vs. Lew Burdette (CAL) on 6/6/1967 (9th inning),Paul Schaal (CAL) vs. Hal Reniff (NYA) on 8/2/1966 (11th inning),Clyde Wright (CAL) vs. A's on 7/3/1970,,,,,,,,,,,,,,,,,,Paul Schaal is the only pinch-hitter to hit the first inside-the-park home run in an active park's first game. Jered Weaver's 9-0 no-hitter against the Twins was the largest margin of victory in an Angels no-hitter.
ARL01,Rangers vs. Angels: 4/21/1972,7-6 (TEX),"20,105",Dick Bosman (TEX); Clyde Wright (CAL),Sandy Alomar Sr. (CAL),Popped to 3B,Frank Howard (TEX),Homered (1st),Frank Howard (TEX),Frank Howard (TEX),Frank Howard (TEX) vs. Clyde Wright (CAL) on 4/21/1972 (1st inning),4/21/1972 (1),Clyde Wright (CAL)/Dave Nelson (TEX),Dick Bosman (TEX),Clyde Wright (CAL),Carlos May (CHA) vs. Jim Panther (TEX) on 6/25/1972 (4th inning),Danny Thompson (MIN) vs. David Clyde (TEX) on 6/24/1974 (4th inning),Mike Witt (CAL) vs. Rangers on 9/30/1984,vs. Royals: 10/3/1993,4-1 (KCA),"41,039",Steve Dreyer (TEX); Kevin Appier (KCA),Juan Gonzalez (TEX),Grounded to SS,Gary Gaetti (KCA),Homered (9),Gary Gaetti (KCA),Gary Gaetti (KCA),Gary Gaetti (KCA) vs. Tom Henke (TEX) on 10/3/1993 (9th inning),Jeff Montgomery (KCA)/Rafael Palmeiro (TEX),Kevin Appier (KCA),Steve Dreyer (TEX),Kirby Puckett (MIN) vs. Roger Pavlik (TEX) on 9/11/1993 (5th inning),Gary Ward (TEX) vs. Chris Codiroli (OAK) on 6/20/1986 (2nd inning),Nolan Ryan (TEX) vs. Blue Jays on 5/1/1999,The first homer ever hit at Arlington Stadium was the 361st of Frank Howard's career and tied him with Joe DiMaggio for 20th on the all time list.
ARL02,Rangers vs. Brewers: 4/11/1994,4-1 (MIL),"46,056",Kenny Rogers (TEX); Jaime Navarro (MIL),Pat Listach (MIL),Grounded to 2B,David Hulse (TEX),Singled to 2B (1st),Dave Nilsson (MIL),Dave Nilsson (MIL),Dave Nilsson (MIL) vs. Kenny Rogers (TEX) on 4/11/1994 (5th inning),4/11/1994 (1),Jaime Navarro (MIL)/Doug Strange (TEX),Jaime Navarro (MIL),Kenny Rogers (TEX),Bernie Williams (NYA) vs. Darren Oliver (TEX) on 6/6/1994 (9th inning),Michael Tucker (KCA) vs. Mike Henneman (TEX) on 8/16/1996 (9th inning),Kenny Rogers (TEX) vs. Angels on 7/28/1994,,,,,,,,,,,,,,,,,,Kenny Rogers' no-hitter against the Angels was the 14th perfect game in MLB history.
ATL01,Braves vs. Pirates: 4/12/1966,3-2 (PIT),"50,671",Tony Cloninger (ATL); Bob Veale (PIT),Matty Alou (PIT),Popped to 1B,Gene Alley (PIT),Singled (1st),Joe Torre (ATL),Joe Torre (ATL),Joe Torre (ATL) vs. Bob Veale (PIT) on 4/12/1966 (5th inning),4/12/1966 (1),Tony Cloninger (ATL)/Willie Stargell (PIT),Don Schwall (PIT),Tony Cloninger (ATL),Hank Aaron (ATL) vs. Wade Blasingame (HOU) on 6/27/1967 (3rd inning),Willie Mays (SFN) vs. Ken Johnson (ATL) on 6/1/1966 (1st inning),Phil Niekro (ATL) vs. Padres on 8/5/1973,vs. Yankees: 10/24/1996 (World Series Game 5),1-0 (NYA),"51,881",John Smoltz (ATL); Andy Pettitte (NYA),Luis Polonia (ATL),Flied to RF,Chipper Jones (ATL),Doubled to LF (9),Charlie Hayes (NYA),Cecil Fielder (NYA),Jim Leyritz (NYA) vs. Mark Wohlers (ATL) on 10/23/1996 (8th inning of Game 4 of World Series),John Smoltz (ATL)/Cecil Fielder (NYA),Andy Pettitte (NYA),John Smoltz (ATL),Gary Gaetti (SLN) vs. Greg Maddux (ATL) on 10/6/1996 (7th inning of NLCS),Jeff Blauser (ATL) vs. Bob McClure (SLN) on 8/23/1992 (7th inning),"Kent Mercker, Mark Wohlers, Alejandro Pena (ATL) vs. Padres on 9/11/1991","Joe Torre hit two solo homers in the first game ever played at Atlanta-Fulton County Stadium, hitting the first and last homers of the contest."
ATL02,Braves vs. Cubs: 4/4/1997,5-4 (ATL),"45,044",Denny Neagle (ATL); Kevin Foster (CHN),Brian McRae (CHN),Bunt Groundout to 1B,Chipper Jones (ATL),Singled to LF (1st),Michael Tucker (ATL),Michael Tucker (ATL),Michael Tucker (ATL) vs. Kevin Foster (CHN) on 4/4/1997 (3rd inning),4/4/1997 (1),Kevin Foster (CHN)/Mark Lemke (ATL),Brad Clontz (ATL),Terry Adams (CHN),Javy Lopez (ATL) vs. Stan Belinda (CIN) on 4/14/1997 (7th inning),Tom Goodwin (COL) vs. Kevin Millwood (ATL) on 4/5/2000 (2nd inning),Randy Johnson (ARI) vs. Braves on 5/18/2004,vs. Tigers: 10/2/2016,1-0 (ATL),"51,220",Justin Verlander (DET); Julio Teheran (ATL),Justin Upton (DET),Struck Out,Miguel Cabrera (DET),Single to RF (9),Ender Inciarte (ATL),Freddie Freeman (ATL),Justin Upton (DET) vs. Aaron Blair (ATL) on 10/1/2016 (7th inning),Jim Johnson (ATL)/Justin Upton (DET),Julio Teheran (ATL),Justin Verlander (DET),Ryan Howard (PHI) vs. Julio Teheran (ATL) on 9/27/2016 (1st inning),Robin Ventura (LAN) vs. Jung Bong (ATL) on 8/3/2003 (7th inning),"Cole Hamels, Jake Diekman, Ken Giles, Jonathan Papelbon (PHI) vs. Braves on 9/1/2014","Randy Johnson's no-hitter against the Braves was the 17th perfect game in MLB history and, at 40, he became the oldest pitcher ever to throw a perfect game."
ATL03,Braves vs. Padres: 4/14/2017,5-2 (ATL),"41,149",Julio Teheran (ATL); Jhoulys Chacin (SDN),Manuel Margot (SDN),Flied to CF,Ender Inciarte (ATL),Singled to 3B (1st),Ender Inciarte (ATL),Nick Markakis (ATL),Ender Inciarte (ATL) vs. Craig Stammen (SDN) on 4/14/2017 (6th inning),4/14/2017 (1),Jhoulys Chacin (SDN)/Adonis Garcia (ATL),Julio Teheran (ATL),Jhoulys Chacin (SDN),Bryce Harper (WAS) vs. Julio Teheran (ATL) on 4/19/2017 (2nd inning),,,,,,,,,,,,,,,,,,,,
BAL11,Orioles vs. White Sox: 4/15/1954,3-1 (BAL),"46,354",Bob Turley (BAL); Virgil Trucks (CHA),Chico Carrasquel (CHA),Singled to RF,Chico Carrasquel (CHA),Singled to RF (1st),Clint Courtney (BAL),Clint Courtney (BAL),Clint Courtney (BAL) vs. Virgil Trucks (CHA) on 4/15/1954 (3rd inning),4/15/1954 (1),Virgil Trucks (CHA)/Vic Wertz (BAL),Bob Turley (BAL),Virgil Trucks (CHA),Cass Michaels (CHA) vs. Jay Heard (BAL) on 5/28/1954 (6th inning),Vern Stephens (BAL) vs. Billy Hoeft (DET) on 7/3/1954 (3rd inning),Hoyt Wilhelm (BAL) vs. Yankees on 9/20/1958,vs. Tigers: 10/6/1991,7-1 (DET),"50,700",Bob Milacki (BAL); Frank Tanana (DET),Cal Ripken (BAL),5-4-3 DP,Cecil Fielder (DET),Singled (8),Mickey Tettleton (DET),Dave Bergman (DET),Chito Martinez (BAL) vs. Mark Leiter (DET) on 10/5/1991 (6th inning),Frank Tanana (DET)/Mike Devereaux (BAL),Frank Tanana (DET),Bob Milacki (BAL),Dwight Evans (BAL) vs. Gene Nelson (OAK) on 7/26/1991 (7th inning),Phil Bradley (BAL) vs. Greg Cadaret (NY) on 6/8/1990 (3rd inning),Wilson Alvarez (CHA) vs. Orioles on 8/11/1991,"On May 8, 1966 Orioles slugger Frank Robinson hit a home run off Cleveland's Luis Tiant that cleared the left field wall and left the park, making Robinson the only player to hit one completely out of Memorial Stadium."
BAL12,Orioles vs. Indians: 4/6/1992,2-0 (BAL),"44,568",Rick Sutcliffe (BAL); Charles Nagy (CLE),Keny Lofton (CLE),Flied to RF,Paul Sorrento (CLE),Singled to LF (2nd),Sam Horn (BAL),Chris Hoiles (BAL),Paul Sorrento (CLE) vs. Bob Milacki (BAL) on 4/8/1992 (1st inning),4/8/1992 (2),Rick Sutcliffe (BAL)/Mark Whiten (CLE),Rick Sutcliffe (BAL),Charles Nagy (CLE),Randy Milligan (BAL) vs. Les Lancaster (DET) on 4/17/1992 (7th inning),Butch Davis (TEX) vs. Arthur Rhodes (BAL) on 8/22/1993 (3rd inning),Hideo Nomo (BOS) vs. Orioles on 4/4/2001,,,,,,,,,,,,,,,,,,Hideo Nomo's April 4th no-hitter came on the second day of the season and is the earliest in the year for any no-hitter thrown in an active park.
BOS06,Americans vs. Athletics: 5/8/1901,12-4 (BOS),"11,500",Bill Bernhard (PHA); Cy Young (BOS),Jack Hayden (PHA),Grounded to 3B,Dave Fultz (PHA),Singled (1st),Tommy Dowd (BOS),Jimmy Collins (BOS),Buck Freeman (BOS) vs. Bill Bernhard (PHA) on 5/8/1901 (1st inning),5/8/1901 (1),Cy Young (BOS)/Phil Geier (PHA),Cy Young (BOS),Bill Bernhard (PHA),Harry Davis (PHA) vs. Doc Adkins (BOS) on 7/8/1902 (6th inning),Buck Freeman (BOS) vs. Bill Bernhard (PHA) on 5/8/1901 (1st inning),Cy Young (BOS) vs. Athletics on 5/5/1904,vs. Senators: 10/7/1911,8-1 (BOS),840,Carl Cashion (WS1); Charley Hall (BOS),Kid Elberfeld (WS1),Grounded to 3B,Germany Schaefer (WS1),Singled (9),Joe Riggert (BOS),Joe Riggert (BOS),Joe Riggert (BOS) vs. Charlie Becker (WS1) on 10/7/1911 (8th inning),,Charley Hall (BOS),Carl Cashion (WS1),Stuffy McInnis (PHA) vs. Charley Hall (BOS) on 6/24/1911 (9th inning),Joe Riggert (BOS) vs. Charlei Becker (WS1) on 10/7/1911 (8th inning),Smoky Joe Wood (BOS) vs. Browns on 7/29/1911,
BOS07,Red Sox vs. Yankees: 4/20/1912,"7-6 (BOS), 11 innings","24,000",Buck O'Brien (BOS); Ray Caldwell (NYA),Guy Zinn (NYA),Walked,Harry Wolter (NYA),Singled on SAC (1st),Guy Zinn (NYA),Roy Hartzell (NYA),Hugh Bradley (BOS) vs. Lefty Russell (PHA) on 4/26/1912 (7th inning),4/26/1912 (5),Buck O'Brien (BOS)/Dutch Sterrett (NYA),Charley Hall (BOS),Hippo Vaughn (NYA),Rabbit Maranville (BSN) vs. Hippo Vaughn (CHN) on 9/26/1914 (4th inning),Sam Crawford (DET) vs. Buck O'Brien (BOS) on 5/10/1912 (9th inning),Iron Davis (BSN) vs. Phillies on 9/19/1914,,,,,,,,,,,,,,,,,,"In the first regular season game at Fenway Park, Red Sox players lost potential triples and home runs thanks to an overflow crowd that was roped off in the outfield as hits into the crowd were ruled doubles. The first homer at Fenway Park was the last of Hugh Bradley's career. The first grand slam at Fenway Park was hit by Boston Braves shortstop Rabbit Maranville and was the last of his career. It was the first time that a park's regular home team didn't account for a first (both grand slam and no-hitter). Red Sox second baseman Steve Yerkes had five hits, the most ever for a park's first game."
BOS08,Braves vs. Cardinals: 8/18/1915,3-1 (BSN),"46,000",Dick Rudolph (BSN); Slim Sallee (SLN),Miller Huggins (SLN),Struck Out,Art Butler (SLN),Singled,Sherry Magee BSN),Rabbit Maranville (BSN),Doc Johnston (PIT) vs. Lefty Tyler (BSN) on 8/23/1915 (7th inning),8/23/1915 (6),,Dick Rudolph (BSN),Slim Sallee (SLN),Red Smith (BSN) vs. Earl Moseley (CIN) on 8/3/1916 (1st inning),Gavvy Cravath (PHI) vs. Dick Rudolph (BSN) on 9/29/1915 (1st inning),Tom Hughes (BSN) vs. Pirates on 6/16/1916,vs. Dodgers: 09/21/1952,8-2 (BRO),"8,822",Jim Wilson (BSN); Joe Black (BRO),Walker Cooper (BSN),Flied to LF,Jackie Robinson (BRO),Singled to CF (9),Joe Black (BRO),Carl Furillo (BRO),Roy Campanella (BRO) vs. Jim Wilson (BSN) on 9/21/1952 (2nd inning),Joe Black (BRO)/Jack Daniels (BSN),Joe Black (BRO),Jim Wilson (BSN),Del Ennis (PHI) vs. Jim Wilson (BSN) on 8/7/1952 (5th inning),Andy Seminick (PHI) vs. Max Surkont (BSN) on 9/1/1950 (6th inning),Cliff Chambers (PIT) vs. Braves on 5/6/1951,"On May 26, 1917 Cardinals outfielder Walton Cruise homered to right field and became the first player to hit a home run at Braves Field that actually cleared a fence. All previous homers were inside-the-park. It wasn't until May 28, 1925 that someone, Giants catcher Frank Snyder, hit a homer over the left field fence. On May 13, 1942 Braves pitcher Jim Tobin homered three times at Braves Field and became the only modern-day pitcher to hit three home runs in one game. On June 19, 1942 Paul Waner singled in the fifth inning to record his 3,000th career hit."
CHI09,White Sox vs. Blues (Indians): 4/24/1901,8-2 (CHA),"9,000",Roy Patterson (CHA); Bill Hoffer (CLE),Ollie Pickering (CLE),Flied to CF,Jack McCarthy (CLE),Singled to 3B (1st),Fielder Jones (CHA),Fred Hartman (CHA),Erve Beck (CLE) vs. John Skopec (CHA) on 4/25/1901 (2nd inning),4/25/1901 (2),Bill Hoffer (CLE)/Roy Patterson (CHA),Roy Patterson (CHA),Bill Hoffer (CLE),Herm McFarland (CHA) vs. Joe Yeager (DET) on 5/1/1901 (2nd inning),Frank Shugart (CHA) vs. Frank Owen (DET) on 4/29/1901 (8th inning),Nixey Callahan (CHA) vs. Tigers on 9/20/1902,vs. Naps (Indians): 06/27/1910,7-2 (CLE),,Fred Olmstead (CHA); Spec Harkness (CLE),Doc White (CHA),Grounded to SS,Fred Payne (CHA),Singled (9),Chick Gandil (CHA),Fred Payne (CHA),Duffy Lewis (BOS) vs. Jim Scott (CHA) on 6/7/1910 (6th inning),Spec Harkness (CLE)/Ed Walsh (CHA),Spec Harkness (CLE),Fred Olmstead (CHA),Germany Schaefer (DET) vs. Ed Walsh (CHA) on 6/28/1908 (2nd inning),Patsy Dougherty (CHA) vs. Bill Bailey (SLA) on 9/2/1909 (1st inning),Addie Joss (CLE) vs. White Sox on 4/20/1910,
CHI10,White Sox vs. Browns: 7/1/1910,2-0 (SLA),"24,900",Ed Walsh (CHA); Barney Pelty (SLA),George Stone (SLA),Doubled to LF,George Stone (SLA),Doubled to LF (1st),Frank Truesdale (SLA),George Stone (SLA),Lee Tannehill (CHA) vs. Bill Donovan (DET) on 7/31/1910 (4th inning),7/31/1910 (10),,Barney Pelty (SLA),Ed Walsh (CHA),Lee Tannehill (CHA) vs. Bill Donovan (DET) on 7/31/1910 (4th inning,Bill Cunningham (WS1) vs. Jim Scott (CHA) on 5/10/1911 (5th inning),Ed Walsh (CHA) vs. Red Sox on 8/27/1911,vs. Mariners: 09/30/1990,2-1 (CHA),"42,849",Jack McDowell (CHA); Rich DeLucia (SEA),Harold Reynolds (SEA),Grounded to 2B,Scott Bradley (SEA),Singled to RF (9),Frank Thomas (CHA),Dan Pasqua (CHA),Alvin Davis (SEA) vs. Eric King (CHA) on 9/29/1990 (4th inning),Jack McDowell (CHA)/Tino Martinez (SEA),Jack McDowell (CHA),Rich DeLucia (SEA),Alvin Davis (SEA) vs. Steve Rosenberg (CHA) on 9/28/1990 (5th inning),Robin Yount (MIL) vs. Ken Patterson (CHA) on 9/13/1988 (1st inning),Jack Morris (DET) vs. White Sox on 4/7/1984,"Comiskey Park hosted the first All-Star Game on July 6, 1933. It hosted the only Opening Day no-hitter in baseball history when Indians hurler Bob Feller blanked the White Sox on April 16, 1940. It saw the American League's color barrier broken when Cleveland's Larry Doby debuted on July 5, 1947."
CHI11,Chicago Whales vs. Kansas City Packers: 4/23/1914,9-1 (CHF),"21,000",Claude Hendrix (CHF); Chief Johnson (KCF),Chet Chadbourne (KCF),Ground out,John Potts (KCF),Singled,Dutch Zwilling (CHF),Jack Farrell (CHF),Art Wilson (CHF) vs. Chief Johnson (KCF) on 4/23/1914 (2nd inning),4/23/1914 (1),,Claude Hendrix (CHF),Chief Johnson (KCF),Rollie Zeider (CHF) vs. Harry Moran (BUF) on 5/6/1914 (4th inning),Max Flack (CHF) vs. Gene Packard (KCF) on 7/11/1915 (3rd inning),Fred Toney (CIN) vs. Cubs on 5/2/1917,,,,,,,,,,,,,,,,,,"Kansas City Packers pitcher Chief Johnson was served with legal papers in the second inning, enjoining him from pitching for Kansas City for the rest of the opener. John Potts, who recorded the first hit at then-Weeghman Park, had only 27 career hits, the fewest for a player who recorded the first hit at an active park. Chicago Whales catcher Art Wilson hit the first two home runs at the park in his first two at-bats. The first no-hitter thrown at Wrigley Field was a double no-hitter for nine innings between Cincinnati's Fred Toney and Chicago's Hippo Vaughn before the Reds recorded the first hit in the 10th inning; The first grand slam was hit by Rollie Zeider, who hit only five home runs in his nine-year career, and was the only homer he hit over the fence on the fly (the other four were either inside-the-park homers or bounced, which counted as homers at the time).  "
CHI12,White Sox vs. Tigers: 4/18/1991,16-0 (DET),"42,191",Jack McDowell (CHA); Frank Tanana (DET),Tony Phillips (DET),Flied to LF,Alan Trammell (DET),Singled to SS (1st),Travis Fryman (DET),Alan Trammell (DET),Cecil Fielder (DET) vs. Jack McDowell (CHA) on 4/18/1991 (3rd innng),4/18/1991 (1),Frank Tanana (DET)/Tim Raines (CHA),Frank Tanana (DET),Jack McDowell (CHA),Kevin Romine (BOS) vs. Alex Fernandez (CHA) on 5/5/1991 (2nd inning),Mark Newfield (SEA) vs. Brian Keyser (CHA) on 6/21/1995 (5th inning),Mark Buehrle (CHA) vs. Rangers on 4/18/2007,,,,,,,,,,,,,,,,,,"The Tigers' 16 runs are the most in a park's first game (minimum 300 games) and the 16-run margin of victory is the largest. Chicago White Sox pitcher Mark Buerhle threw the first two no-hitters at U.S. Cellular Field, making him the only pitcher to toss the first two no-hitters at an active park. All three no-hitters at U.S. Cellular Field were thrown by southpaws. Tigers teammates Tony Phillips and Alan Trammell had four hits each in the first game at U.S. Cellular Field, becoming the only teammates with four hits in a park's first game. Kevin Romine, who hit the first grand slam at U.S. Cellular Field, hit only five home runs in his career and the grand slam was his last.  He also holds the distinction of having the fewest career home runs among those who hit a park's first grand slam (tied with Rollie Zeider)."
CIN06,Reds vs. Cubs: 4/17/1902,6-1 (CHN),"10,000",Jack Taylor (CHN); Len Swormstedt (CIN),Jimmy Slagle (CHN),Walked,Jake Beckley (CIN),Singled,Dummy Hoy (CIN),Jake Beckley (CIN),Homer Smoot (SLN) vs. Bill Phillips (CIN) on 4/25/1902 (5th inning),4/25/1902 (6),,Jack Taylor (CHN),Len Swormstedt (CIN),Miller Huggins (CIN) vs. Ed Poole (BRO) on 5/10/1904 (2nd inning),Homer Smoot (SLN) vs. Bill Phillips (CIN) on 4/25/1902 (5th inning),None,vs. Cubs: 10/12/1911,4-3 (CIN),400,Cy Slapnicka (CHN); Bert Humphries (CIN),Wilbur Good (CHN),Popped Out,Cy Slapnicka (CHN),Singled,Vic Saier (CHN),Cy Slapnicka (CHN),Ed McDonald (BSN) vs. Harry Gaspar (CIN) on 9/29/1911 (2nd inning),,Bert Humphries (CIN),Cy Slapnicka (CHN),Tex Erwin (BRO) vs. Art Fromme (CIN) on 7/28/1911 (6th inning),Ed McDonald (BSN) vs. Harry Gaspar (CIN) on 9/29/1911 (2nd inning),None,The grand slam Miller Huggins hit was his first career homer.  The inside-the-park homer by McDonald was his first career homer.
CIN07,Reds vs. Cubs: 4/11/1912,10-6 (CIN),"23,500",Frank Smith (CIN); King Cole (CHN),Johnny Evers (CHN),Grounded to 2B,Jimmy Sheckard (CHN),Singled to 2B (1st),Bob Bescher (CIN),Dick Hoblitzell (CIN),Jimmy Esmond (CIN) vs. Bill Steele (SLN) on 4/21/1912 (6th inning),4/21/1912 (6),,Bert Humphries (CIN),King Cole (CHN),Edd Roush (CIN) vs. Rube Marquard (BRO) on 8/19/1918 (7th inning),Jimmy Esmond (CIN) vs. Bill Steele (CHN) on 4/21/1912 (6th inning),Hod Eller (CIN) vs. Cardinals on 5/11/1919,vs. Giants: 6/24/1970,5-4 (CIN),"28,027",Jim McGlothlin (CIN); Juan Marichal (SFN),Bobby Bonds (SFN),Grounded to P,Lee May (CIN),Homered (8),Lee May (CIN),Lee May (CIN),Lee May (CIN) vs. Juan Marichal (SFN) on 6/24/1970 (8th inning),Jim McGlothlin (CIN)/Bobby Bonds (SFN),Wayne Granger (CIN),Juan Marichal (SFN),Willie Stargell (PIT) vs. Wayne Simpson (CIN) on 5/1/1970 (7th inning),Alex Johnson (CIN) vs. Grant Jackson (PHI) on 8/8/1969 (1st inning),Don Wilson (HOU) vs. Reds on 05/1/1969,"On May 24, 1935 the Reds and Phillies played the first Major League game under lights. Crosley Field saw consecutive no-hitters thrown on April 30 and May 1, 1969 when Reds pitcher Jim Maloney blanked the Astros on April 30, and Astros pitcher Don Wilson whitewash the Reds the next day. On May 19, 1970 Hank Aaron recorded his 3000th hit with a first-inning single off Wayne Simpson in the second game of a doubleheader."
CIN08,Reds vs. Braves: 6/30/1970,8-2 (ATL),"51,050",Jim McGlothlin (CIN); Pat Jarvis (ATL),Sonny Jackson (ATL),Struck Out,Felix Millan (ATL),Singled to CF (1st),Felix Millan (ATL),Hank Aaron (ATL),Hank Aaron (ATL) vs. Jim McGlothlin (CIN) on 6/30/1970 (1st inning),6/30/1970 (1),Jim McGlothlin (CIN)/Sonny Jackson (ATL),Pat Jarvis (ATL),Jim McGlothlin (CIN),Tony Perez (CIN) vs. Jim McAndrew (NYN) on 8/11/1970 (2nd inning),Roberto Clemente (PIT) vs. Gary Nolan (CIN) on 5/19/1971 (3rd inning),Ken Holtzman (CHN) vs. Reds on 6/3/1971,vs. Phillies: 9/22/2002,4-3 (PHI),"40,964",Jose Rijo (CIN); Brandon Duckworth (PHI),Todd Walker (CIN),Grounded to 2B,Jason Michaels (PHI),Singled (9),Aaron Boone (CIN),Aaron Boone (CIN),Aaron Boone (CIN) vs. Dan Plesac (PHI) on 9/22/2002 (8th inning),Jose Mesa (PHI)/Travis Dawkins (CIN),Brandon Duckworth (PHI),Jose Rijo (CIN),Jose Guillen (CIN) vs. Alberto Reyes (PIT) on 9/9/2002 (6th inning),Ken Griffey Jr. (CIN) vs. Andy Benes (SLN) on 8/20/2001 (11th inning),Tom Browning (CIN) vs. Dodgers on 9/16/1988,"On April 4, 1974  Hank Aaron homered off Reds hurler Jack Billingham and tied Babe Ruth with 714 career home runs. On September 11, 1985 Pete Rose slapped a first-innng single off San Diego's Eric Show for career hit number 4,192 to pass Ty Cobb and become the all-time hit king."
CIN09,Reds vs. Pirates: 3/31/2003,10-1 (PIT),"42,343",Jimmy Haynes (CIN); Kris Benson (PIT),Kenny Lofton (PIT),Grounded to 1B,Ken Griffey Jr. (CIN),Doubled to RF (1st),Randall Simon (PIT),Reggie Sanders (CIN),Reggie Sanders (PIT) vs. Jimmy Haynes (CIN) on 3/31/2003 (2nd inning),3/31/2003 (1),Kris Benson (PIT)/Austin Kearns (CIN),Kris Benson (PIT),Jimmy Haynes (CIN),Carlos Delgado (TOR) vs. John Reidling (CIN) on 6/6/2003 (2nd inning),Eric Young (MIL) vs. Jeff Austin (CIN) on 5/11/2003 (6th inning),Homer Bailey (CIN) vs. Giants on 7/2/2013,,,,,,,,,,,,,,,,,,"Great American Ballpark is one of four parks to open in March. One of three parks where the first grand slam came in an interleague game (Chase Field: 1998 and Safeco Field:1999). Homer Bailey's no-hitter was his second in 19 starts. His first also had the distinction of being the first no-hitter thrown at Pittsburgh's PNC Park and he became the second pitcher to throw the first no-hitter at multiple parks (Hideo Nomo: 1996, 2001)."
CLE06,Naps vs. Tigers: 4/21/1910,5-0 (DET),"18,832",Cy Young (CLE); Ed Willett (DET),Matty McIntyre (DET),Grounded Out,Nig Clarke (CLE),Singled,Oscar Stanage (DET),Ed Willett (DET),Roy Hartzell (SLA) vs. Addie Joss (CLE) on 5/28/1910 (1st inning),5/28/1910 (10),,Ed Willett (DET),Cy Young (CLE),Ivy Olson (CLE) vs. Tom Hughes (WS1) on 5/18/1911 (6th inning),Roy Hartzell (SLA) vs. Addie Joss (CLE) on 5/28/1910 (1st inning),Wes Ferrell (CLE) vs. Browns on 4/29/1931,vs. Tigers: 9/21/1946,5-3 (DET),"2,772",Bob Kuzava (CLE); Dizzy Trout (DET),Jack Conway (CLE),Lined into 4-3 DP,Gene Woodling (CLE),Singled (11),George Kell (DET),Dick Wakefield (DET),Dick Wakefield (DET) vs. Red Embree (CLE) on 9/20/1946 (5th inning),Dizzy Trout (DET)/Howie Moss (CLE),Dizzy Trout (DET),Joe Berry (CLE),Pat Seerey (CLE) vs. Buck Ross (CHA) on 8/2/1945 (3rd inning),Ted Williams (BOS) vs. Red Embree (CLE) on 9/13/1946 (1st inning),Wes Ferrell (CLE) vs. Browns on 4/29/1931,"On July 19, 1915 the Washington Senators set a record when they stole eight bases in the first inning against pitchers Rip Hagerman and ""Sad Sam"" Jones, and catcher Steve O'Neill. On August 8, 1929 Babe Ruth belted his 500th career home run with a second-inning shot off Willis Hudlin. "
CLE07,Indians vs. Athletics: 7/31/1932,1-0 (PHA),"76,979",Mel Harder (CLE); Lefty Grove (PHA),Max Bishop (PHA),Singled,Max Bishop (PHA),Singled,Max Bishop (PHA),Mickey Cochrane (PHA),Johnny Burnett (CLE) vs. Tommy Thomas (WS1) on 8/07/1932 (6th inning),8/7/1932 (7),,Lefty Grove (PHA),Mel Harder (CLE),Willie Kamm (CLE) vs. Firpo Marberry (WS1) on 9/18/1932 (3rd inning),Johnny Burnett (CLE) vs. Johnny Welch (BOS) on 9/14/1932 (8th inning),Don Black (CLE) vs. Athletics on 7/10/1947,vs. White Sox: 10/3/1993,4-0 (CHA),"72,390",Charles Nagy (CLE); Jason Bere (CHA),Mark Lewis (CLE),Struck Out,Drew Denson (CHA),Singled to LF (8),Joey Cora (CHA),Frank Thomas (CHA),Albert Belle (CLE) vs. Jose DeLeon (CHA) on 10/2/1993 (8th inning),Jose DeLeon (CHA)/Mark Lewis (CLE),Jason Bere (CHA),Charles Nagy (CLE),Carlos Baerga (CLE) vs. Joe Boever (OAK) on 7/20/1993 (3rd inning),Mel Hall (CLE) vs. Rick Honeycutt (OAK) on 7/6/1988 (7th inning),Dave Stieb (TOR) vs. Indians on 9/02/1990,"On July 17, 1941 Joe DiMaggio went 0 for 3 with a walk against Al Smith and Jim Bagby to break his 56-game hitting streak. On June 17, 1960 Ted Williams recorded his 500th career home run with a third-inning blast off Wynn Hawkins. "
CLE08,Indians vs. Mariners: 4/4/1994,"4-3 (SEA), 11 innings","41,459",Dennis Martinez (CLE); Randy Johnson (SEA),Rich Amaral (SEA),Grounded to 2B,Eric Anthony (SEA),Homered to RF (3rd),Edgar Martinez (SEA),Eric Anthony (SEA),Eric Anthony (SEA) vs. Dennis Martinez (CLE) on 4/4/1994 (3rd inning),4/4/1994 (1),Dennis Martinez (CLE)/Ken Griffey Jr. (SEA),Eric Plunk (CLE),Kevin King (SEA),Paul Sorrento (CLE) vs. Doug Linton (KCA) on 5/9/1995 (1st inning),David Bell (CLE) vs. Randy Johnson (SEA) on 4/15/1998 (1st inning),Ervin Santana (LAA) vs. Indians on 7/27/2011,,,,,,,,,,,,,,,,,,"David Bell hit the first inside-the-park home run at then-Jacobs Field in the bottom of the first inning against Seattle's Randy Johnson.  Two innings later Johnson threw two pitches at Kenny Lofton's head and touched off a bench-clearing brawl, after which Johnson, Lofton, and Indians catcher Sandy Alomar Jr. were ejected from the game. The first no-hitter was thrown 17 years after the park opened, the longest gap among active parks in which a no-hitter has been thrown.  Interestingly, Cleveland's League Park boasts the longest gap---21 years---among inactive parks in which a no-hitter was thrown.  Washington's Griffith Stadium went 20 years before the first no-hitter was thrown and Philadelphia's Veterans Stadium went 19 years. "
